{
  "$schema": "http://json-schema.org/draft-07/schema#",
  "title": "OER",
  "description": "This is a generic JSON schema for describing an Open Educational Resource with schema.org",
  "type": "object",
  "default": {
    "@context": [
      "https://w3id.org/kim/lrmi-profile/draft/context.jsonld",
      {
        "@language": "de"
      }
    ]
  },
  "properties": {
    "@context": {
      "$ref": "https://dini-ag-kim.github.io/lrmi-profile/draft/schemas/schemas/context-schema.json"
    },
    "id": {
      "$ref": "https://dini-ag-kim.github.io/lrmi-profile/draft/schemas/schemas/id.json"
    },
    "type": {
      "$ref": "https://dini-ag-kim.github.io/lrmi-profile/draft/schemas/schemas/type.json"
    },
    "name": {
      "$ref": "https://dini-ag-kim.github.io/lrmi-profile/draft/schemas/schemas/name.json"
    },
    "creator": {
      "$ref": "https://dini-ag-kim.github.io/lrmi-profile/draft/schemas/schemas/creator.json"
    },
    "description": {
      "$ref": "https://dini-ag-kim.github.io/lrmi-profile/draft/schemas/schemas/description.json"
    },
    "about": {
      "$ref": "https://dini-ag-kim.github.io/lrmi-profile/draft/schemas/schemas/about.json"
    },
    "license": {
      "$ref": "https://dini-ag-kim.github.io/lrmi-profile/draft/schemas/schemas/license.json"
    },
    "image": {
      "$ref": "https://dini-ag-kim.github.io/lrmi-profile/draft/schemas/schemas/image.json"
    },
    "dateCreated": {
      "$ref": "https://dini-ag-kim.github.io/lrmi-profile/draft/schemas/schemas/dateCreated.json"
    },
    "inLanguage": {
      "$ref": "https://dini-ag-kim.github.io/lrmi-profile/draft/schemas/schemas/inLanguage.json"
    },
    "publisher": {
      "$ref": "https://dini-ag-kim.github.io/lrmi-profile/draft/schemas/schemas/publisher.json"
    },
    "learningResourceType": {
      "$ref": "https://dini-ag-kim.github.io/lrmi-profile/draft/schemas/schemas/learningResourceType.json"
    },
    "audience": {
      "$ref": "https://dini-ag-kim.github.io/lrmi-profile/draft/schemas/schemas/audience.json"
    },
    "isBasedOn": {
      "$ref": "https://dini-ag-kim.github.io/lrmi-profile/draft/schemas/schemas/isBasedOn.json"
    },
    "mainEntityOfPage": {
      "$ref": "https://dini-ag-kim.github.io/lrmi-profile/draft/schemas/schemas/mainEntityOfPage.json"
    }
  },
  "required": [
    "@context",
    "id",
    "name"
  ]
}