{
  "@context": [
    "https://w3id.org/kim/amb/draft/context.jsonld",
    "https://schema.org",
    {
      "@language": "de"
    }
  ],
  "name": "Beispielkurs",
  "id": "https://example.org/oer",
  "type": [
    "LearningResource",
    "Course"
  ],
  "learningResourceType": [
    {
      "id": "https://w3id.org/kim/hcrt/course"
    }
  ]
}