{
    "@context": [ 
      "https://w3id.org/kim/lrmi-profile/draft/context.jsonld",
      "https://json-ld.org/contexts/person.jsonld"
    ],
    "name": "Beispielkurs",
    "id": "https://example.org/oer",
    "type": "Course",
    "learningResourceType": {
      "id": "https://w3id.org/kim/hcrt/course"
    }
  }